Supermercado,Producto,Precio
Carrefour,Ajo suelto x kg.,"$ 7.690,00"
Carrefour,Tomate perita x kg.,"$ 5.499,00"
Carrefour,Sandía x kg.,"$ 2.499,00"
Carrefour,Rúcula x 1 atado,"$ 699,00"
Carrefour,Acelga x paquete,"$ 1.189,00"
Carrefour,Cebolla morada x kg.,"$ 1.799,00"
Carrefour,Lechuga morada kg.,"$ 5.599,00"
Carrefour,Lechuga francesa hidropónica 220 g.,"$ 1.899,00"
Carrefour,Lima taití x kg.,"$ 2.999,00"
Carrefour,Maní tostado pelado sin sal x kg.,"$ 5.290,00"
Carrefour,Snack manzana roja deshidratada Frutty 18 g.,"$ 535,00"
Carrefour,Chaucha ballina x kg.,"$ 4.999,00"
Carrefour,Chaucha rolliza x kg.,"$ 4.999,00"
Carrefour,Limon organico 1 kg.,"$ 1.199,00"
Carrefour,Ciruelas desecadas sin cáscara Presidente x 200 g.,"$ 1.290,00"
Carrefour,Almendras peladas 50 g.,"$ 1.800,00"
Carrefour,Pera roja x kg.,"$ 2.290,00"
Carrefour,Ciruelas desecadas sin carozos 200 g.,"$ 1.500,00"
Carrefour,Maní japonés x kg.,"$ 5.190,00"
Carrefour,Piña comercial x kg.,"$ 1.799,00"
Carrefour,Mix de frutas secas 150 g,"$ 2.660,00"
Carrefour,Almendras sin cáscara Blancalmen 100 g.,"$ 2.890,00"
Carrefour,Nueces con cáscara 250 g.,"$ 2.450,00"
Carrefour,Repollo orgánico x kg.,"$ 1.499,00"
Carrefour,Chip de banana 100 g.,"$ 1.990,00"
Carrefour,Nueces peladas El mercado 300 g.,"$ 8.990,00"
Carrefour,Castañas de cajú 150 g.,"$ 4.690,00"
Carrefour,Hongos shitake laminados Villares 25 g.,"$ 1.690,00"
Carrefour,Mix supremo 50 g.,"$ 1.450,00"
Carrefour,Tomates secos 70 g.,"$ 2.229,00"
Carrefour,Almendras El Mercado 400 g.,"$ 11.900,00"
Carrefour,Ají picante x kg.,"$ 3.999,00"
Carrefour,Mix de frutas secas con nuez 100 g.,"$ 1.690,00"
Carrefour,Albahaca hidropónica Vequa en cono,"$ 1.549,00"
Carrefour,Castañas de cajú El mercado 350 g.,"$ 11.900,00"
Carrefour,Castañas de caju saladas x kg.,"$ 26.990,00"
Carrefour,Mix de frutos secos salados Beepure en frasco 190 g.,"$ 4.539,00"
Carrefour,Ensalada mix verdes 300 g.,"$ 3.799,00"
Carrefour,Mix frutos secos Grandiet proteínas 150 g.,"$ 3.590,00"
Carrefour,Coco x kg.,"$ 2.999,00"
Carrefour,Frutos secos Maní Mix Saladito 150 g.,"$ 1.990,00"
Carrefour,Ensalada Rocky mezclum con cherry 300 g.,"$ 2.999,00"
Carrefour,Mix de frutos secos supremo 150 g.,"$ 4.500,00"
Carrefour,Pasas de uva con chocolate Los Carolinos 150 g.,"$ 2.990,00"
Carrefour,Kale y remolacha 200 g.,"$ 2.699,00"
Carrefour,Ensalada Rocky cuatro colores 250 g.,"$ 2.999,00"
Carrefour,Ensalada vegetariana 180 g.,"$ 4.099,00"
Carrefour,Mix europa 500 g.,"$ 8.990,00"
Carrefour,Batata naranja Huella Natural x kg.,"$ 1.100,00"
Carrefour,Ajo suelto x kg.,"$ 7.690,00"
Carrefour,Tomate perita x kg.,"$ 5.499,00"
Carrefour,Sandía x kg.,"$ 2.499,00"
Carrefour,Naranja de jugo x kg.,"$ 999,00"
Carrefour,Rúcula x 1 atado,"$ 1.890,00"
Carrefour,Acelga x paquete,"$ 699,00"
Carrefour,Cebolla morada x kg.,"$ 1.189,00"
Carrefour,Berenjena negra x kg.,"$ 1.799,00"
Carrefour,Lechuga Capuchina x kg.,"$ 3.499,00"
Carrefour,Lechuga morada kg.,"$ 5.599,00"
Carrefour,Lechuga francesa hidropónica 220 g.,"$ 1.899,00"
Carrefour,Lima taití x kg.,"$ 2.999,00"
Carrefour,Maní tostado pelado sin sal x kg.,"$ 5.290,00"
Carrefour,Almendras 135 g.,"$ 4.990,00"
Carrefour,Snack manzana roja deshidratada Frutty 18 g.,"$ 535,00"
Carrefour,Chaucha ballina x kg.,"$ 4.999,00"
Carrefour,Chaucha rolliza x kg.,"$ 4.999,00"
Carrefour,Pasas de uva 170 g.,"$ 1.890,00"
Carrefour,Mandioca x kg,"$ 1.400,00"
Carrefour,Limon organico 1 kg.,"$ 1.199,00"
Carrefour,Ciruelas desecadas sin cáscara Presidente x 200 g.,"$ 1.290,00"
Carrefour,Almendras peladas 50 g.,"$ 1.800,00"
Carrefour,Pera roja x kg.,"$ 2.290,00"
Carrefour,Champignones y portobellos mix Porto 180 g.,"$ 2.099,00"
Carrefour,Ciruelas desecadas sin carozos 200 g.,"$ 2.499,00"
Carrefour,Maní japonés x kg.,"$ 1.500,00"
Carrefour,Piña comercial x kg.,"$ 5.190,00"
Carrefour,Tomate seco 100 g.,"$ 1.799,00"
Carrefour,Plátano x kg.,"$ 3.290,00"
Carrefour,Mix de frutas secas 150 g,"$ 2.660,00"
Carrefour,Almendras sin cáscara Blancalmen 100 g.,"$ 2.890,00"
Carrefour,Nueces con cáscara 250 g.,"$ 2.450,00"
Carrefour,Repollo orgánico x kg.,"$ 1.499,00"
Carrefour,Chip de banana 100 g.,"$ 1.990,00"
Carrefour,Nueces peladas El mercado 300 g.,"$ 8.990,00"
Carrefour,Castañas de cajú 150 g.,"$ 4.690,00"
Carrefour,Hongos shitake laminados Villares 25 g.,"$ 1.690,00"
Carrefour,Pasas de uva Pasablanca 150 g.,"$ 1.390,00"
Carrefour,Mix de lechugas Huella Natural 300 g.,"$ 3.399,00"
Carrefour,Mix supremo 50 g.,"$ 1.450,00"
Carrefour,Tomates secos 70 g.,"$ 2.229,00"
Carrefour,Almendras El Mercado 400 g.,"$ 11.900,00"
Carrefour,Ají picante x kg.,"$ 3.999,00"
Carrefour,Mix de frutas secas con nuez 100 g.,"$ 1.690,00"
Carrefour,Albahaca hidropónica Vequa en cono,"$ 1.549,00"
Carrefour,Castañas de cajú El mercado 350 g.,"$ 11.900,00"
Carrefour,Castañas de caju saladas x kg.,"$ 26.990,00"
Carrefour,Palta (Kg),$9990.00
La Anonima,Zapallo Anco (Kg),"$ 6.249,00"
La Anonima,Pomelo (Kg),"$ 4.999,20"
La Anonima,Remolacha S/Hoja (Kg),"$730,00"
La Anonima,Zapallo Criollo (Kg),"$ 599,00"
La Anonima,Repollo Blanco (Kg),"$2.500,00"
La Anonima,Repollo Colorado (Kg),"$ 2.290,00"
La Anonima,Ajo Granel (Kg),"$3.350,00"
La Anonima,Sandía (Kg),"$ 2.990,00"
La Anonima,Albahaca x unidad,"$860,00"
La Anonima,Apio Envasado x 300 g.,"$ 759,00"
La Anonima,Berenjena Variedades (Kg),"$1.800,00"
La Anonima,Ajo En Bolsita (Kg),"$ 1.590,00"
La Anonima,Zapallo Anco Fraccionado (Kg),"$2.100,00"
La Anonima,Soja (Kg),"$ 1.890,00"
La Anonima,Higos Desecados Conosur x 200 g.,"$10.250,00"
La Anonima,Hinojo (Kg),"$ 7.990,00"
La Anonima,Zapallo Anco en Rodajas (Kg),"$3.350,00"
La Anonima,Escarola Envasada x 300 g.,"$ 2.990,00"
La Anonima,Papa Granel (Kg),"$1.850,00"
La Anonima,Banana Ecuador (Kg),"$ 1.490,00"
La Anonima,Cebolla (Kg),"$2.900,00"
La Anonima,Zanahoria (Kg),"$ 2.590,00"
La Anonima,Mandarina (Kg),$2390.00
La Anonima,Manzana Red Bolsita (Kg),"$ 1.690,00"
La Anonima,Zapallito Redondo (Kg),"$10.900,00"
La Anonima,Pera (Kg),"$ 8.690,00"
La Anonima,Limón (Kg),"$860,00"
La Anonima,Naranja (Kg),"$ 689,15"
La Anonima,Zapallo Ingles (Kg),"$4.600,00"
La Anonima,Tomate Redondo (Kg),"$ 3.990,00"
La Anonima,Batata (Kg),"$7.850,00"
La Anonima,Zanahoria Comercial Bolsita (Kg),"$ 3.790,00"
La Anonima,Manzana Red Elegida (Kg),"$3.400,00"
La Anonima,Berenjena (Kg),"$ 2.990,00"
La Anonima,Batata Boniato (Kg),"$990,00"
La Anonima,Rúcula Envasada x 70 gr,"$ 792,82"
La Anonima,Papa Bolsita Elegida (Kg),"$2.450,00"
La Anonima,Choclo sin chala Envasado x 530 gr,"$ 2.290,00"
La Anonima,Lechuga Hidropónica x unidad,"$ 1.399,00"
La Anonima,Acelga Envasada x 500 gr,"$ 1.119,20"
La Anonima,Papa Comercial Bolsita (Kg),"$ 1.990,00"
La Anonima,Zapallo Anco Comercial Bolsita (Kg),"$ 1.624,00"
La Anonima,Morrón Colorado (Kg),"$ 1.299,20"
La Anonima,Uvas (Kg),"$ 1.190,00"
La Anonima,Manzana Grany Elegida (Kg),"$ 1.890,00"
La Anonima,Lechuga Francesa Envasada x 250 gr,$1990.00
La Anonima,Lechuga Capuchina Envasada x 350 gr,"$ 1.590,00"
La Anonima,Champignon Portobello Bandeja x 200 gr,"$ 2.290,00"
La Anonima,Cebolla de Verdeo Envasada x 250 g.,"$ 1.624,00"
La Anonima,Espinaca Envasada X Unidad x 400 gr,"$ 1.299,20"
La Anonima,Kiwi (Kg),"$ 990,00"
La Anonima,Champignon Bandeja x 200 gr,$2990.00
La Anonima,Morrón Verde (Kg),"$ 2.690,00"
La Anonima,Lechuga Mantecosa Envasada x 200 gr,"$ 699,00"
La Anonima,Pepino (Kg),"$ 559,20"
La Anonima,Girasol Tostado sin Sal x 200 gr,"$ 4.890,00"
La Anonima,Girasol Tostado Salado x 200 gr,"$ 1.290,00"
La Anonima,Cebolla Roja (Kg),"$ 999,00"
La Anonima,Zapallito Largo (Kg),"$ 2.990,00"
La Anonima,Perejil Envasado x 100 gr,"$ 1.690,00"
La Anonima,Melón (Kg),"$ 1.590,00"
La Anonima,Cebolla Comercial Bolsita (Kg),"$ 1.590,00"
La Anonima,Manzana Grany Comercial Bolsita (Kg),"$ 1.490,00"
La Anonima,Brócoli (Kg),"$ 3.590,00"
La Anonima,Penca de Acelga x 300 g.,"$ 1.690,00"
La Anonima,Maní Tostado Con Cascara (Kg),$2749.00
La Anonima,Ensalada Coleslaw x 250 g.,"$ 2.499,00"
La Anonima,Coliflor (Kg),"$ 1.190,00"
La Anonima,Rabanito Envasado x 200 gr,"$ 569,00"
La Anonima,Zanahoria Baby envasada x 250 gr,"$ 6.590,00"
La Anonima,Perejil X Atado x 1 Un.,"$ 3.990,00"
La Anonima,Semilla de Chía El Peoncito x 175 g.,"$ 2.990,00"
La Anonima,Vegetales para Sopa O Guarnición Mic Rie La Huerta x 400 g.,"$ 3.990,00"
La Anonima,Vegetales para Wok Rie La Huerta x 370 g.,"$ 2.990,00"
La Anonima,Semillas de Lino For Good x 150 g.,"$ 2.490,00"
La Anonima,Semilla de Girasol Pelado El Peoncito x 175 g.,"$ 1.990,00"
La Anonima,Jengibre (Kg),"$ 2.890,00"
La Anonima,Zanahoria Rallada Rie La Huerta x 250 g.,$7999.00
La Anonima,Semilla de Sésamo Integral El Peoncito x 175 g.,"$ 6.249,00"
La Anonima,Cebolla Blanca (Kg),"$ 4.999,20"
La Anonima,Pasas de Uva Negras El Peoncito x 250 g.,"$ 2.490,00"
La Anonima,Cilantro Envasado x 70 gr,"$ 4.990,00"
La Anonima,Ciruela (Kg),"$ 3.990,00"
La Anonima,Tomate Cherry (Kg),"$ 2.590,00"
La Anonima,Nueces Peladas El Peoncito Bolsa x 100 g.,"$ 799,00"
La Anonima,Tomates Secos El Peoncito x 100 g.,"$ 799,00"
La Anonima,Tomate Perita (Kg),"$ 2.290,00"
La Anonima,Morrón Variedades (Kg),"$ 2.590,00"
La Anonima,Mango (Kg),"$ 1.390,00"
La Anonima,Lechuga Morada Envasada x 1 Un.,"$ 1.990,00"
La Anonima,Pasas de Uva Sultanina Negras El Peoncito x 100 g.,"$ 1.099,00"
La Anonima,Maní Frito con Piel Maní King x 500 g.,"$ 1.990,00"
La Anonima,Quinoa El Peoncito x 175 g.,"$ 4.690,00"
La Anonima,Lechuga Capuchina (Kg),"$ 899,00"
La Anonima,Maní Honey Roasted Spicy Dec Alimentos x 220 g.,"$ 4.990,00"
La Anonima,Mix de Frutos Secos Salados El Peoncito x 100 g.,"$ 2.290,00"
La Anonima,Brócoli Envasado x 250 g.,"$ 3.990,00"
La Anonima,Almendras Peladas El Peoncito x 100 g.,"$ 1.490,00"
La Anonima,Castañas de Caju Salada y Tostada Villares x 150 g.,"$ 2.490,00"
La Anonima,Hierbas Aromáticas Frescas x 20 g.,"$ 1.390,00"
La Anonima,Nueces Peladas Mariposa El Peoncito x 200 g.,"$ 2.400,00"
La Anonima,Mix Frutas Secas El Peoncito x 250 g.,"$ 3.490,00"
La Anonima,Mix Araucano El Peoncito x 250 g.,"$ 3.490,00"
La Anonima,Ensalada Lechugas y Cherry Rie Rie La Huerta x 200 g.,"$ 920,00"
La Anonima,Nuez C/Cascara (Kg),"$ 1.800,00"
La Anonima,Blanco de Apio Rie La Huerta x 300 g.,"$ 6.990,00"
La Anonima,Espinaca Baby Hojas Verdes y Rojas Rie La Huerta x 150 g.,"$ 2.490,00"
La Anonima,Puerro Envasado x 250 g.,"$ 1.100,00"
La Anonima,Lechuga Hidropónica Mantecosa x 1 Un.,"$ 2.290,00"
La Anonima,Mix Frutas Secas The Happy Snack x 300 g.,"$ 2.100,00"
La Anonima,Mix de Frutos Secos Tropical El Peoncito x 100 g.,"$ 1.590,00"
La Anonima,Piña (Kg),"$ 2.890,00"
La Anonima,Espinaca y Acelga Lavada y Cortada Mic Rie La Huerta x 500 g.,"$ 4.990,00"
La Anonima,Mix de Frutas Secas Desec Patagónico El Peoncito x 100 g.,"$ 3.400,00"
La Anonima,Nueces Peladas Pote Conosur x 100 g.,"$ 3.000,00"
La Anonima,Pistacho c/Cascara Salado y Tostado El Peoncito x 200 g.,"$ 4.890,00"
La Anonima,Cramberries El Peoncito x 150 g.,"$ 6.590,00"
La Anonima,Semillas de Chía For Good x 150 g.,"$ 7.999,00"
La Anonima,Cebolla Verdeo (Kg),"$ 3.990,00"
La Anonima,Choclo sin chala (Kg),"$ 960,00"
La Anonima,Mix de Frutas Secas El Peoncito x 100 g.,"$ 3.990,00"
La Anonima,Pasas de Uva Moscatel El Peoncito x 250 g.,"$ 3.050,00"
La Anonima,Mix Brócoli Coliflor x 300 g.,"$ 2.990,00"
La Anonima,Almendras La Anónima (Kg),"$ 2.850,00"
La Anonima,Cebolla en Tubo (Kg),"$ 2.000,00"
La Anonima,Zanahoria Rallada Roots x 250 g.,"$ 2.990,00"
La Anonima,Espinaca Baby Rie La Huerta x 150 g.,"$ 3.550,00"
La Anonima,Kale & Remolacha Sueño Verde x 200 g.,"$ 6.200,00"
La Anonima,Almendras Peladas Medianas El Peoncito x 250 g.,"$ 1.590,00"
La Anonima,Mix Europeo El Peoncito x 250 g.,"$ 6.650,00"
La Anonima,Ensalada Lechuga Repollo y Zanahoria Rie La Huerta x 200 g.,"$ 5.000,00"
La Anonima,Ensalada Rúcula y Radicchio Sueño Verde x 110 g.,"$ 4.100,00"
La Anonima,Plátano (Kg),"$ 3.290,00"
La Anonima,Coco (Kg),"$ 4.390,00"
La Anonima,Maní Japones Conosur x 400 g.,"$ 3.750,00"
La Anonima,Mix de Frutas Secas Maní Almendras Casta Croppers x 80 g.,"$ 635,00"
La Anonima,Radiccio Envasado x 320 gr,"$ 2.290,00"
La Anonima,Chips de Manzana Roja Fruch x 35 g.,"$ 1.690,00"
La Anonima,Pasas de Uva Sultaninas La Parmesana x 250 g.,"$ 142,00"
La Anonima,Chips de Manzana Verde Fruch x 35 g.,"$ 1.690,00"
La Anonima,Mix de Frutas The Happy Snack x 40 g.,"$ 880,00"
La Anonima,Mix Europa The Happy Snack x 40 g.,"$ 920,00"
La Anonima,Mix Desayuno The Happy Snack x 40 g.,"$ 880,00"
La Anonima,Mix Energético The Healthy Snack x 50 g.,"$ 87,00"
La Anonima,Pistachos Tostados y Salados El Peoncito x 100 g.,"$ 5.000,00"
La Anonima,Avellanas Peladas Villares x 150 g.,"$ 315,00"
La Anonima,Semillas de Girasol El Peoncito x 100 g.,"$ 1.450,00"
La Anonima,Semillas de Chía El Peoncito x 100 g.,"$ 1.650,00"
La Anonima,Lechuga Hidropónica Variedades x 1 Un.,"$ 1.690,00"
La Anonima,Mix Desayuno The Happy Snack x 300 g.,"$ 5.350,00"
La Anonima,Ensalada Cítrica Sueño Verde x 200 g.,"$ 3.990,00"
La Anonima,Semillas de Chía Genser x 150 g.,"$ 999,00"
La Anonima,Almendras Peladas sin Tacc The Happy Snack x 50 g.,"$ 2.100,00"
La Anonima,Mix Energético sin Tacc The Happy Snack x 50 g.,"$ 1.600,00"
La Anonima,Ciruelas Secas El Peoncito x 500 g.,"$ 344,00"
La Anonima,Mix Global sin Tacc The Happy Snack x 25 g.,"$ 620,00"
La Anonima,Pasas de Uva Sultanina Negras El Peoncito x 250 g.,"$ 2.300,00"
La Anonima,Espinaca Baby Hidropónica Vequa x 170 g.,"$ 1.190,00"
La Anonima,Chaucha Envasada Mic x 230 g.,"$ 3.490,00"
La Anonima,Zanahoria y Remolacha Rallada Rie La Huerta x 250 g.,"$ 1.190,00"
La Anonima,Garrapiñada de Maní Conosur x 500 g.,"$ 4.150,00"
La Anonima,Mix Saladito Pote Conosur x 150 g.,"$ 2.550,00"
La Anonima,Acelga Cortada Rocky Rocky x 500 g.,"$ 1.190,00"
La Anonima,Ciruelas D Agen sin Carozo Nature Food x 200 g.,"$ 2.500,00"
La Anonima,Ciruelas President sin Carozo Nature Food x 200 g.,"$ 2.900,00"
La Anonima,Dátiles Nature Food x 200 g.,"$ 4.800,00"
La Anonima,Higos Negros con Almendras Los Carolinos x 250 g.,"$ 549,00"
La Anonima,Higos Negros Desecados Nature Food x 200 g.,"$ 2.900,00"
La Anonima,Mix de Frutas Deshidratadas Nature Food x 200 g.,"$ 3.450,00"
La Anonima,Pasas de Uva Rubias El Peoncito x 250 g.,"$ 336,00"
La Anonima,Pasas de Uva Morenas sin Semillas Nature Food x 200 g.,"$ 2.600,00"
La Anonima,Ciruela Presidente sin Carozo El Peoncito x 250 g.,"$ 5.500,00"
La Anonima,Pasas de Uva Rubias sin Semillas Nature Food x 200 g.,"$ 2.900,00"
La Anonima,Peras en Mitades Desecadas Nature Food x 200 g.,"$ 2.700,00"
La Anonima,Tomates Peritas Deshidratados Nature Food x 150 g.,"$ 4.750,00"
La Anonima,Cereza (Kg),"$ 4.390,00"
La Anonima,Cebolla en Juliana x 260 g.,"$ 999,00"
La Anonima,Frutas Surtidas Escurridas Almibaradas Villares x 250 g.,"$ 670,00"
La Anonima,Hongos de Pino El Peoncito x 75 g.,"$ 2.900,00"
La Anonima,Nuez Pecan con Cascara (Kg),"$ 9.590,00"
La Anonima,Maíz Frito Miel y Mostaza Atuel Valley x 30 g.,"$ 1.050,00"
La Anonima,Durazno (Kg),"$ 2.890,00"
La Anonima,Cebolla Picada x 260 g.,"$ 999,00"
La Anonima,Pelón (Kg),"$ 2.890,00"
La Anonima,Brotes de Alfalfa Atama Alimentos x 1 Un.,"$ 0,00"
La Anonima,Papines Andinos x 600 g.,"$ 4.290,00"
La Anonima,Girgolas x 150 g.,"$ 2.490,00"
La Anonima,Almendras Conosur x 135 g.,"$ 328,00"
La Anonima,Mix Coleslaw Rocky Rocky x 250 g.,"$ 1.390,00"
La Anonima,Repollitos de Bruselas Apto Micro x 250 g.,"$ 699,00"
La Anonima,Nuez Pecan Pelada Puerto Pecan x 250 g.,"$ 7.990,00"
La Anonima,Maní Honey Roasted Dec Alimentos x 350 g.,"$ 4.100,00"
La Anonima,Pipas Peladas sin Sal Pipas x 180 g.,"$ 2.350,00"
La Anonima,Pipas Peladas Natural Pipas x 180 g.,"$ 2.350,00"
La Anonima,Repollo Brusela (Kg),"$ 1.990,00"
La Anonima,Remolacha en Cubos La Anónima x 350 g.,"$ 699,00"
La Anonima,Esparrago Envasado x 350 g.,"$ 1.490,00"
La Anonima,Naranja Comercial Bolsita (Kg),$3490.00
La Anonima,Mix de Frutas Seca-Semillas Granada El Peoncito x 100 g.,"$ 2.990,00"
La Anonima,Tomates Deshidratados El Peoncito x 100 g.,"$ 2.150,00"
La Anonima,Semillas de Sésamo El Peoncito x 100 g.,"$ 3.200,00"
La Anonima,Mix de Frutas Conosur x 150 g.,"$ 1.700,00"
La Anonima,Bocaditos de Higo c/Nuez Los Carolinos x 225 g.,"$ 252,00"
La Anonima,Mix de Frutas Secas Mani Almendras Pasas Croppers x 100 g.,"$ 434,00"
La Anonima,Mix de Frutas Secas Mani-Alm Cast Croppers x 100 g.,"$ 142,00"
La Anonima,Maní Tostado sin Sal Maní King x 500 gr,"$ 147,00"
La Anonima,Coliflor Envasado x 300 g.,"$ 3.990,00"
La Anonima,Almendras Peladas Villares x 150 g.,"$ 2.990,00"
La Anonima,Almendras Saladas y Tostadas El Peoncito x 100 g.,"$ 5.950,00"
La Anonima,Hongos de Pino El Peoncito x 75 g.,"$ 4.100,00"
La Anonima,Nueces Peladas Mariposa Villares x 100 g.,"$ 176,00"
La Anonima,Tomates Secos El Peoncito x 100 g.,"$ 4.000,00"
La Anonima,Banana Chips El Peoncito x 150 g.,"$ 145,00"
La Anonima,Ciruelas Secas Dagen El Peoncito x 500 g.,"$ 115,00"
La Anonima,Cramberries El Peoncito x 150 g.,"$ 362,00"
La Anonima,Ristra de Higos c/Nuez Aldeva x 200 g.,"$ 188,00"
La Anonima,Mix de Semillas El Peoncito x 175 g.,"$ 309,00"
La Anonima,Lechuga x unidad,"$ 76,00"
La Anonima,Higos Negros Los Carolinos x 200 g.,"$ 1.690,00"
La Anonima,Quinoa El Peoncito x 175 g.,"$ 401,00"
La Anonima,Semilla de Chía El Peoncito x 175 g.,"$ 137,00"
La Anonima,Semilla de Girasol Pelado El Peoncito x 175 g.,"$ 94,00"
La Anonima,Semillas de Lino El Peoncito x 175 g.,"$ 68,00"
La Anonima,Semilla de Sésamo Integral El Peoncito x 175 g.,"$ 47,50"
La Anonima,Mix Tropical El Peoncito x 200 g.,"$ 79,00"
La Anonima,Nueces Peladas Mariposa El Peoncito x 200 g.,"$ 189,00"
La Anonima,Pistacho c/Cascara Salado T Tostado El Peoncito x 200 g.,"$ 360,00"
La Anonima,Almendras Pelada Mediana El Peoncito x 250 g.,"$ 529,00"
La Anonima,Ciruela Presidente sin Carozo El Peoncito x 250 g.,"$ 453,00"
La Anonima,Mix de Desayuno Alicante x 150 g.,"$ 149,00"
La Anonima,Mix Araucano El Peoncito x 250 g.,"$ 615,00"
La Anonima,Mix Europeo El Peoncito x 250 g.,"$ 232,00"
La Anonima,Mix Frutas Secas El Peoncito x 250 g.,"$ 340,00"
La Anonima,Mix Patagónico El Peoncito x 250 g.,"$ 279,00"
La Anonima,Mix Serrano El Peoncito x 250 g.,"$ 371,00"
La Anonima,Pasas de Uva Negras El Peoncito x 250 g.,"$ 276,00"
La Anonima,Pasas de Uva Rubias El Peoncito x 250 g.,"$ 112,00"
La Anonima,Almendras Enteras Grado Superior Buenos Vientos x 100 g.,"$ 212,00"
La Anonima,Almendras Enteras Gr Sup Tostadas Buenos Vientos x 100 g.,"$ 905,00"
La Anonima,Mix de Frutos Secos Seleccionados Buenos Vientos x 150 g.,"$ 1.109,00"
La Anonima,Nuez Mariposa Grado Superior Buenos Vientos x 150 g.,"$ 1.259,00"
La Anonima,Ciruelas Disecadas A.Rodriguez x 250 g.,"$ 1.189,00"
La Anonima,Pasas de Uva Sultanina A.Rodriguez x 100 g.,"$ 0,00"
La Anonima,Semillas Snack Girasol For Good x 120 g.,"$ 0,00"
La Anonima,Ají Picante (Kg),"$ 109,00"
La Anonima,Ají Vinagre (Kg),"$ 6.990,00"
La Anonima,Pimiento Dulce Palermo (Kg),"$ 1.999,00"
La Anonima,Ciruelas Presidente s/Carozo Villares x 200 g.,"$ 6.990,00"
La Anonima,Lima Tahiti (Kg),"$ 279,00"
La Anonima,Mix Frutas Secas Croppers Arándados Rojos x 100 g.,"$ 2.990,00"
La Anonima,Pasas de Uva Sultanina Negra Pote Villares x 200 g.,"$ 202,00"
La Anonima,Champignon Portobello Granel (Kg),"$ 2.050,00"
La Anonima,Mix Frutas Secas Croppers Nueces & Bananas x 100 g.,"$ 12.450,00"
La Anonima,Lechuga Francesa (Kg),"$ 216,00"
La Anonima,Mix Frutas Secas Croppers Almendras & Arándanos x 100 g.,"$ 3.990,00"
La Anonima,Lechuga Mantecosa (Kg),"$ 200,00"
La Anonima,Semillas de Girasol For Good x 125 g.,"$ 3.990,00"
La Anonima,Sésamo Tostado For Good x 150 g.,"$ 1.150,00"
La Anonima,Tomate Comercial Chico (Kg),"$ 132,00"
La Anonima,Alcayota (Kg),$1600.00
La Anonima,Manzana Variedades (Kg),"$ 1.290,00"
La Anonima,Plantines Chicos x 1 Un.,"$ 899,00"
La Anonima,Ají Dulce (Kg),"$ 2.990,00"
La Anonima,Hongos Secos El Peoncito x 50 g.,"$ 1.890,00"
La Anonima,Arándanos x 125 gr,"$ 4.590,00"
La Anonima,Semillas de Lino El Peoncito x 100 g.,"$ 2.750,00"
La Anonima,Maíz Frito y Salado El Peoncito x 100 g.,"$ 1.790,00"
La Anonima,Berro Hidropónico x 1 Un.,"$ 46,90"
La Anonima,Achicoria (Kg),"$ 2.700,00"
La Anonima,Maní Tostado con Pasas de Uva Croppers x 100 g.,"$ 2.290,00"
La Anonima,Almendras Tostadas Saladas Croppers x 80 g.,$229.00
La Anonima,Alcaucil (Kg),"$ 169,00"
La Anonima,Avellanas Peladas Allhue x 100 g.,"$ 97,00"
La Anonima,Mix de Frutos Secos y Pasas Europeo El Peoncito x 100 g.,"$ 296,00"
La Anonima,Nueces Peladas Mariposa Allhue x 100 g.,"$ 999,00"
La Anonima,Almendras Peladas Allhue x 100 g.,"$ 55,00"
La Anonima,Radicheta Sueño Verde x 100 g.,"$ 2.800,00"
La Anonima,Rúcula Sueño Verde x 100 g.,"$ 51,00"
La Anonima,Banana Chips El Peoncito x 150 g.,"$ 1.990,00"
La Anonima,Achicoria Envasada x 150 g.,"$ 2.690,00"
La Anonima,Mix Tropical El Peoncito x 200 g.,"$ 252,00"
La Anonima,Radicheta Envasada x 70 gr,"$ 2.850,00"
La Anonima,Pasas de Uva Sultanina Rubias El Peoncito x 100 g.,"$ 1.850,00"
La Anonima,Mix Patagónico El Peoncito x 250 g.,"$ 7.500,00"
La Anonima,Ciboulette Envasado x 70 gr,"$ 1.590,00"
La Anonima,Plantines de Hortalizas x 1 Un.,"$ 1.890,00"
La Anonima,Pimienta Negra En Grano 50 Gr,$1.690
Jumbo,Oregano Deshidratado,$1.290
Jumbo,Ajo Deshidratado Molido,$1.690
Jumbo,Pimenton Extra X 50 Grs,$1.390
Jumbo,Adobo Para Pizza 100 Gr,$1.749
Jumbo,Condimento Para Pizza X 100 Grs,$1.790
Jumbo,Ají Molido 100 Gr,$1.990
Jumbo,Aji  Deshidratado Molido,$1.990
Jumbo,Condimento Para Preparar Pesto X 100 Grs,$NaN
Jumbo,Sal De Ajo X 100 Grs,$NaN
Jumbo,Chimichurri Clasico Deshidratado,$NaN
Jumbo,Huevos Blancos Maxima 30 U,$5.650
Jumbo,Huevos Blancos Doña Lala Maple X 30 U,$7.150
Jumbo,Huevos Blancos Avicoper 30 U,$6.750
Jumbo,Huevos Libres De Jaula Cuisine &co X6,$1.950
Jumbo,Huevos Blancos Avicoper 6 U - 1 Paquete,$1.650
Jumbo,Huevos Blancos Doña Lala X 12u Carton,$3.200
Jumbo,Huevo Color  Avicereal Media Docena Caja X 6,$2.450
Jumbo,Huevos De Color Avicoper 12 U - 1 Paquete,$4.750
Jumbo,Lentejas A Granel 500 Gr,$1.999
Jumbo,Arroz Yamani 400 Gr,$849
Jumbo,Harina De Garbanzo,$1.499
Jumbo,Lentejas A Granel 500 Gr,$2.499
Jumbo,Garbanzos X 500 Gr-bsa-gr.-500,$2.499
Jumbo,Harina De Lino-bolsa-gr.-250,$1.599
Jumbo,Mezcla De Semillas Nativa 250 Gr,$2.499
Jumbo,Harina De Quinoa-bsa-gr.-250,$5.990
Jumbo,Poroto A Granel Vegetales 500 Gr,$4.999
Jumbo,Mix Wok For Good 120 Gr,$449
Jumbo,Lentejas A Granel 250 Gr,$3.299
Jumbo,Zanahoria Orgánica Fraccionada X 1 Kilo,$2.699
Jumbo,Ajo Organico X 3,$999
Jumbo,Pera Orgánica,$2.499
Jumbo,Palta Hass Organica X Unidad,"$928,57"
Jumbo,Mix Puerro Y Verde,$2.499
Jumbo,Cebolla Cobriza Organica Fraccionada,$3.690
Jumbo,Banana Ecuador Por Kg,$1.899
Jumbo,Palta Hass Elegida Unidad,$699
Jumbo,Almendras Peladas Sueltas X Kg,$11.999
Jumbo,Nueces Mariposa Sin Cascara Por Kg,$14.999
Jumbo,Naranja Jugo Especial Por Kg,$2.699
Jumbo,Manzana Roja Por Kg,$1.699
Jumbo,Naranja Para Jugo El Kg.,$999
Jumbo,Limón X Kg,$699
Jumbo,Castañas De Caju 1 Kg.,$NaN
Jumbo,Piña Gold X Kg,$NaN
Jumbo,Melón Blanco Por Kg,$NaN
Jumbo,Castañas De Caju 150 Gr,$NaN
Jumbo,Lima X Kg,$NaN
Jumbo,Frambuesas X400g Green Life,$NaN
Jumbo,Pera Red Battler  1 Kg,$NaN
Jumbo,Granola Berries X 400gr,$NaN
Jumbo,Manzana Rome 1 Kg,$3.999
Jumbo,Frutillas Karinat X300g,$4.250
Jumbo,Datiles X Kg.,$17.999
Jumbo,Plátano X Kg,$2.699
Jumbo,Granola Energética X 400gr,$3.490
Jumbo,Mix Enegertico - Sin Tacc,$1.290
Jumbo,Castañas De Caju Tostadas Y Saladas - Sin Tacc,$1.690
Jumbo,Granola Tropical X 400gr,$3.490
Jumbo,"Granola Frutos Secos, Semillas Y Miel X 1kg","$9.749,25"
Jumbo,Higos De Smirna 200 Gr,"$5.249,25"
Jumbo,Damascos Turcos Pote 200 Gr,"$5.999,25"
Jumbo,Granberries  Pote 100 Gr,"$2.249,25"
Jumbo,Kaqui X Kg,$3.999
Jumbo,Pizzitos De Jamón Y Queso Nikitos 80 Gr,"$449,25"
Jumbo,Papas Fritas Nikitos Clasicas 100 Gr,"$974,25"
Jumbo,Peras Desecadas X 150 Grs-pot-un.-1,"$1.117,5"
Jumbo,Mix De Frutas Secas Y Desecadas Por U,$1.690
Jumbo,Mix Fitness 150 Grs,$2.590
Jumbo,Maní 150 Gr,$2.299
Jumbo,Mix Saludable X 300g Kosfood,$4.490
Jumbo,Cookies Coco Mix Green Choice 150 Gr.,$1.990
Jumbo,Mix Desayuno X 300 Gr Sin Marca,"$5.616,39"
Jumbo,Mix Energetico X 100g Kosfood,$1.490
Jumbo,School Mix Green Choice,$599
Jumbo,Mix Patagonico X 100g Kosfood,$NaN
Jumbo,Mix Tropical X 200g Kosfood,$NaN
